{"energyPlanId":"33333333-3333-4333-8333-333333333333","site":"DE","planningHorizon":{"from":"2026-06-22T00:00:00Z","to":"2026-06-23T00:00:00Z"},"scheduledJobs":[{"jobId":"DE-ROLL-20260622-01","slotStart":"2026-06-22T02:00:00Z","slotEnd":"2026-06-22T04:00:00Z","deadline":"2026-06-22T08:00:00Z","energyMwh":42.5}],"expectedEnergyPerTon":4.3,"expectedCo2PerTon":0.71,"expectedCostEur":18500.0,"baselineComparison":{"baselineEnergyPerTon":5.0,"baselineCo2PerTon":0.91,"baselineCostEur":22000.0},"deadlineBreaches":[],"solver":"Milp","origin":"Real","status":"Proposed"}
